{
  "$schema": "https://json-schema.org/draft/2020-12/schema",
  "title": "P2-VIS-001 sanitized Cinder prerequisite activation",
  "type": "object",
  "additionalProperties": false,
  "required": [
    "assessment_id", "package_id", "action_id", "assessed_at",
    "assessment_mode", "authorization_reference", "sanitization_status",
    "raw_output_committed", "credential_material_exposed", "change_scope",
    "validation", "package_boundary", "decision", "remaining_blockers",
    "explicitly_not_claimed"
  ],
  "properties": {
    "assessment_id": {"const": "P2-VIS-001-CINDER-PREREQUISITE-001"},
    "package_id": {"const": "ZT-VIS-002"},
    "action_id": {"const": "P2-VIS-001"},
    "assessed_at": {"type": "string", "format": "date-time"},
    "assessment_mode": {"const": "APPROVED_LIVE_INFRASTRUCTURE_PREREQUISITE"},
    "authorization_reference": {"const": "USER_APPROVED_2026-08-21_CINDER_LVM_PREREQUISITE"},
    "sanitization_status": {"const": "PASS"},
    "raw_output_committed": {"const": false},
    "credential_material_exposed": {"const": false},
    "change_scope": {
      "type": "object",
      "additionalProperties": false,
      "required": [
        "provider", "environment", "dedicated_virtual_disk_created",
        "dedicated_virtual_disk_size_gb", "dedicated_virtual_disk_allocation",
        "reviewed_scsi_slot", "existing_nova_instance_storage_preserved",
        "root_volume_group_preserved", "cinder_volume_group",
        "cinder_thin_pool_size_gb", "cinder_configuration_enabled",
        "cinder_lvm_backend_enabled", "cinder_backup_enabled", "kolla_release_line",
        "kolla_prechange_backup_preserved"
      ],
      "properties": {
        "provider": {"const": "OPENSTACK_KOLLA_ANSIBLE"},
        "environment": {"const": "NON_PRODUCTION_SINGLE_NODE_AIO"},
        "dedicated_virtual_disk_created": {"const": true},
        "dedicated_virtual_disk_size_gb": {"const": 100},
        "dedicated_virtual_disk_allocation": {"const": "VMWARE_THIN"},
        "reviewed_scsi_slot": {"const": "SCSI_0_2"},
        "existing_nova_instance_storage_preserved": {"const": true},
        "root_volume_group_preserved": {"const": true},
        "cinder_volume_group": {"const": "cinder-volumes"},
        "cinder_thin_pool_size_gb": {"const": 95},
        "cinder_configuration_enabled": {"const": true},
        "cinder_lvm_backend_enabled": {"const": true},
        "cinder_backup_enabled": {"const": false},
        "kolla_release_line": {"const": "2026.1"},
        "kolla_prechange_backup_preserved": {"const": true}
      }
    },
    "validation": {
      "type": "object",
      "additionalProperties": false,
      "required": [
        "kolla_prechecks", "loadbalancer_database_routes",
        "tagged_cinder_iscsi_deploy", "block_storage_service_present",
        "volume_v3_endpoint_count", "enabled_up_volume_service_count",
        "intentionally_disabled_backup_service_count",
        "running_cinder_iscsi_container_count", "unhealthy_container_count",
        "exited_container_count", "positive", "negative", "bypass",
        "persistence", "rollback", "original_instance_states_restored"
      ],
      "properties": {
        "kolla_prechecks": {"const": "PASS"},
        "loadbalancer_database_routes": {"const": "PASS"},
        "tagged_cinder_iscsi_deploy": {"const": "PASS"},
        "block_storage_service_present": {"const": true},
        "volume_v3_endpoint_count": {"const": 2},
        "enabled_up_volume_service_count": {"const": 2},
        "intentionally_disabled_backup_service_count": {"const": 1},
        "running_cinder_iscsi_container_count": {"const": 5},
        "unhealthy_container_count": {"const": 0},
        "exited_container_count": {"const": 0},
        "positive": {"const": "TEMPORARY_1_GIB_VOLUME_AVAILABLE_WITH_BACKEND_LV_PASS"},
        "negative": {"const": "UNAUTHENTICATED_API_REQUEST_DENIED_401_PASS"},
        "bypass": {"const": "INVALID_TOKEN_API_REQUEST_DENIED_401_PASS"},
        "persistence": {"const": "AIO_REBOOT_DEVICE_VG_SERVICES_VOLUME_AND_BACKEND_LV_PASS"},
        "rollback": {"const": "TEMPORARY_VOLUME_REMOVED_OPENSTACK_ZERO_BACKEND_LV_ZERO_PASS"},
        "original_instance_states_restored": {"const": "ACTIVE_ACTIVE_SHUTOFF_PASS"}
      }
    },
    "package_boundary": {
      "type": "object",
      "additionalProperties": false,
      "required": [
        "cinder_prerequisite_status", "package_runtime_executed",
        "terraform_plan_created", "terraform_apply_executed",
        "ansible_visibility_playbook_executed", "central_monitoring_completed",
        "package_runtime_promoted", "runtime_acceptance_status",
        "maturity_assessed", "compliance_assessed"
      ],
      "properties": {
        "cinder_prerequisite_status": {"const": "RUNTIME_VALIDATED"},
        "package_runtime_executed": {"const": false},
        "terraform_plan_created": {"const": false},
        "terraform_apply_executed": {"const": false},
        "ansible_visibility_playbook_executed": {"const": false},
        "central_monitoring_completed": {"const": false},
        "package_runtime_promoted": {"const": false},
        "runtime_acceptance_status": {"const": "PENDING"},
        "maturity_assessed": {"const": false},
        "compliance_assessed": {"const": false}
      }
    },
    "decision": {"const": "CINDER_PREREQUISITE_ACCEPTED_CENTRAL_DEPLOYMENT_NO_GO"},
    "remaining_blockers": {
      "type": "array", "minItems": 4, "uniqueItems": true,
      "items": {"type": "string", "minLength": 1}
    },
    "explicitly_not_claimed": {
      "type": "array", "minItems": 5, "uniqueItems": true,
      "items": {"type": "string", "minLength": 1}
    }
  }
}
